reviewId,userName,userImage,content,score,thumbsUpCount,reviewCreatedVersion,at,replyContent,repliedAt,appVersion
3bea0166-b6f6-4a66-bf20-71fe2e2ac847,Megan Strickland,https://play-lh.googleusercontent.com/a-/ALV-UjWhgoCUeEj6KJ0i4rLO2Q9id_JxSY3Lgo1LIgfxO5q1gL99z1w,"I want to love bumble. But 24 hours after a match to connect?! Some of us don't live in our phones but still want to connect with people. Flawed concept. Don't stop people from connecting after they have made a match. And the app does not always respond. Of course your reply is ""spend money"" extend for 24 more hours when again a person won't get online and thus renders this useless. You don't seem to care about connecting people. You just want money.",2,3,5.368.0,2024-05-11 05:09:20,We appreciate you sharing your feedback with us. We are always looking for ways to improve our members' experience on the app so we will make sure to pass your input along to our Product Team.,2024-05-11 07:56:50,5.368.0
d2039639-dbc9-40dd-8d3c-0214de1d6f3c,Aamin Gadkari,https://play-lh.googleusercontent.com/a-/ALV-UjXD0wytqynFtIXaEpAroI0TzM8P5et3KXWBRayrfqNsml0sin0E,Bad,3,3,5.368.0,2024-05-11 05:08:51,We’re so sorry to hear you haven’t had a great experience. We’d love to learn more about what you think might make your experience on Bumble better. Please send us a message at bumble.com/contact. We're all ears. 💛,2024-05-11 07:56:20,5.368.0
1745dcb4-5ed6-4186-a879-28d7a97a830e,Denisse Cabello Cabrera,https://play-lh.googleusercontent.com/a/ACg8ocIxEj73E9fCSRSX4mAKrdyTM4DbiOZz2vxDS4XGNRAAFEobETE=mo,Bumble... Why you are trying to make me pay for a subscription by showing me the worst of the worst... Jesus,1,15,,2024-05-11 04:42:42,We're sorry you didn't enjoy your experience on Bumble. Our team would love the opportunity to improve your experience in the Hive! Please message our Support Team on Twitter or Facebook (@BumbleSupport) and we'd be happy to help.,2024-05-11 07:57:20,
c19a1a21-a142-404a-bcf3-03554f446a3e,Loki Springer,https://play-lh.googleusercontent.com/a-/ALV-UjX_jo3mUwh_6pfCAHP1gCnj9Z23w1QS7sjns5thJYRFJ8AO50kR,Why do you guys turn off comments when a bumble ad comes up? Worried about the hate comment calling your company out that's its only use for hookups and scammers.,1,23,,2024-05-11 04:22:15,"We take fake profiles seriously on our platform and have a team dedicated to investigating suspicious accounts. If you’re ever unsure about a profile, please report them in the app and we'll investigate right away!",2024-05-11 07:57:49,
377e6621-a9e0-4605-844f-8fb875ca6728,Ranvir Singh,https://play-lh.googleusercontent.com/a/ACg8ocIsuLiA_jvAwvOEFSxAHPme1AxVsRMKUID--z3Nx-0Id9uSWQ=mo,I am 18 year plus still I can't login what is this 🤦🏻‍♂️ app shows you are not 18 years,1,2,5.368.0,2024-05-11 04:18:45,Don't worry—we can totally help you with this! Please message our Support Team on Facebook or Twitter (@BumbleSupport) or at bumble.com/contact and we'll have a second look.,2024-05-11 07:58:19,5.368.0
4567210f-fd11-473e-90d9-4a36f617d1f9,suchitra thakur,https://play-lh.googleusercontent.com/a-/ALV-UjVDSswwE0jyMi9z4UO3kgjMfhbubxhHuMUexRPWE_0Ik4GJdCDHXg,Verifying picture is extremely difficult.. I tried Verifying multiple times. It doesn't get verified. Not at all user friendly,1,4,5.368.0,2024-05-11 03:59:47,Oh no! Our Support Team would be more than happy to help assist you with verifying your profile. Send us a quick message at bumble.com/contact or on Facebook or Twitter (@BumbleSupport) and we'll get you up and buzzin' in no time!,2024-05-11 07:58:21,5.368.0
c8c1749d-1d43-43aa-aa2d-87ffc31db5b5,Diogo Silva,https://play-lh.googleusercontent.com/a-/ALV-UjXCmzbV3Zgc5Ok9XMWsalvNuH7G7cDiCJkbL46uXXWNFPGWQGY,So this ... app creator think we are going to date virtualy and have a concierge!!! To go in dates for us.... kill society in every front. Quick unistalll,1,8,5.125.2,2024-05-11 03:58:56,,,5.125.2
a2aa39bd-9d88-4bc7-ba19-ba81fcca329e,Michael Nadolny,https://play-lh.googleusercontent.com/a-/ALV-UjUaxwGtgBvpvQ_dARYjixuEmgaNwmaY4B6Qy3_lC6DSX13R4lhzFw,Number of likes is excruciatingly small and they don't appear to ever refresh. Company delivers cringe and fake response.,1,8,5.368.0,2024-05-11 03:18:04,"We're so sorry about your experience with us. We absolutely do not tolerate fake profiles on Bumble and would like to look into this. Please message our Support Team on Twitter or Facebook (@BumbleSupport), so our team can look into this.",2024-05-11 07:58:49,5.368.0
7ffeadff-fcf7-488b-a9d1-d4d5525f3f8f,Bro Walton Bro Walton,https://play-lh.googleusercontent.com/a/ACg8ocJWNeJ45PFrEvHX1QZ1XxPaIsvxczsJZLtxr94qy7uUcZoF4Q=mo,good,5,0,,2024-05-11 03:11:17,We appreciate your kind words. 🙌,2024-05-11 07:56:19,
b007ab31-8372-4ea4-98e3-83df76077f2f,Kienz91,https://play-lh.googleusercontent.com/a-/ALV-UjXN_qVXhuebKdPFb4pnHVM1raZP1h-IVCq_ZBDGkKIJAJK1X1JT,Why is there no trial? How do i know if this app can be useful or no???,1,3,5.368.0,2024-05-11 03:08:47,"Thank you for your message. For further assistance, please get in touch with our support team at: bumble.com/contact. Thank you. 💛",2024-05-11 07:55:53,5.368.0
af909e00-e149-4c13-a176-78dff081b062,E. Christian Martinez,https://play-lh.googleusercontent.com/a-/ALV-UjWiQz-EHoe4ENacWz9Ko1vRLksOdyt9eoBbeD-iif6mIVAeCe6sAQ,don't waste your time,1,13,,2024-05-11 02:55:06,We're sorry you didn't enjoy your experience on Bumble. Our team would love the opportunity to improve your experience in the Hive! Please message our Support Team on Twitter or Facebook (@BumbleSupport) and we'd be happy to help.,2024-05-11 07:55:51,
c41ce785-4b7f-405e-9894-7895b9483783,Jordan Pasilan,https://play-lh.googleusercontent.com/a-/ALV-UjV6qVffbdyGNTEtscZmumzYLKuDgq8k-YaihuMA3Yer6DhghXTd,i like ut but i can't afford to have a premium,3,3,5.368.0,2024-05-11 02:28:18,"All of our core features are free to use. You don't have to pay to swipe, make matches, or send messages. We offer a few paid options to access additional features, but they're totally optional. You don't have to pay to make authentic connections in the Hive. If you have any questions, definitely reach out to our Support Team at bumble.com/contact",2024-05-11 07:55:49,5.368.0
4f1caab0-4b2f-44e2-8d74-09538f17e646,Jean Elliott,https://play-lh.googleusercontent.com/a/ACg8ocIVDYBFIYZD2bxwZGmipweWwXxCDzoUnPy0nZbZHHba_98Q3w=mo,men can't make the first move,1,5,5.368.0,2024-05-11 02:17:23,"Thank you for your feedback, Jean. The new update of Bumble introduced new ways to make the first move, which offers more choices in how women connect while staying in control. Women now have a choice on how to start conversations by letting men make the first move if they want to. Please contact us at bumble.com/contact if you have any questions.",2024-05-11 09:50:18,5.368.0
79377ca5-e4ae-4ab2-83fb-f8e82f1e628b,Chuck Lemberg,https://play-lh.googleusercontent.com/a/ACg8ocLChqRt7P3ccc5V9iZt0BpsIEn1gnomIUJ8zPftjJdUYWmPcSE=mo,One of only a couple of sites that I have used that actually has real people on it.,4,1,5.368.0,2024-05-11 01:35:05,We appreciate your kind words. 🙌,2024-05-11 07:58:50,5.368.0
5ba11488-6400-4342-a286-5d4907c88a27,jen,https://play-lh.googleusercontent.com/a/ACg8ocLecnYKKzXi4MoPHrJrYRSsUb9g7xArRj5SP4duHkY9oruDzg=mo,"This apps ai wont approve a photo obviously me and i took my profile photos yesterday and did not edit them whatsodamn ever. Matches cant communicate with eachother. Cant put that I got a bachelors degree makes me sound stupid by calling it ""undergraduate"" the only nationality for white people is ""white"" you cant put causes you care about not offered. This is trash.",1,1,,2024-05-11 01:32:17,"Our team moderates based on our photo guidelines (https://bit.ly/3tU0sBS). If you think there’s been a mistake, our team would be more than happy to take a second look. Please send us a message here: bumble.com/contact. We’re here for you! 💛",2024-05-11 07:59:19,
3164ce5b-da9c-476b-b4c0-404a2288bf51,Connor Boyd,https://play-lh.googleusercontent.com/a-/ALV-UjVT-ENBClGEad--5_HiNj9nfLDIcx0qeaatPS3V19lvIBYMnCbnCg,Trash,1,10,,2024-05-11 00:54:30,We're sorry you didn't enjoy your experience on Bumble. Our team would love the opportunity to improve your experience in the Hive! Please message our Support Team on Twitter or Facebook (@BumbleSupport) and we'd be happy to help.,2024-05-11 07:54:22,
01b6a955-0aaa-4256-a272-842d251ac406,Eric theNinja,https://play-lh.googleusercontent.com/a/ACg8ocIzYeEw6fozx0zZOdOmdtZ-7rdNr58XDinB6HWFXd6IGBJZLg=mo,"Paywalls for everything, have to pay for likes matches and compliments seprately oh yeh plus you gotta pay to have yor profile seen",1,11,5.364.0,2024-05-11 00:47:58,"All of our core features are free to use. You don't have to pay to swipe, make matches, or send messages. We offer a few paid options to access additional features, but they're totally optional. You don't have to pay to make authentic connections in the Hive. If you have any questions, definitely reach out to our Support Team at bumble.com/contact",2024-05-11 07:54:20,5.364.0
6bf5ed8e-351c-429a-80a7-6c788bb9c185,Roarthis,https://play-lh.googleusercontent.com/a-/ALV-UjWr2zf8A-6_B4fbsElOOWVqqGnRf7FMI-D5SjBtChoryXNeS68,Bots and bots and oh yeah more bots don't forget to pay so bots can talk to u,1,5,,2024-05-11 00:11:27,"We take fake profiles seriously on our platform and have a team dedicated to investigating suspicious accounts. If you’re ever unsure about a profile, please report them in the app and we'll investigate right away!",2024-05-11 07:54:18,
307b43bf-aa1a-4208-9aa0-9295091d20c1,Daniel Johnson,https://play-lh.googleusercontent.com/a/ACg8ocK8EGqXhQoAb8hj0dH7cQ3MvowsV3hK1k0NyzHnaqWyPslu2w=mo,"Bumble decided to ditch it's original ""women make the first move"" concept and switched to just being yellow Tinder with filters.",1,17,,2024-05-11 00:06:32,We're sorry you didn't enjoy your experience on Bumble. Our team would love the opportunity to improve your experience in the Hive! Please message our Support Team on Twitter or Facebook (@BumbleSupport) and we'd be happy to help.,2024-05-11 07:53:49,
a15c2935-f03b-41c0-ad7f-3bcc3698445b,Schweitzer,https://play-lh.googleusercontent.com/a/ACg8ocIUPfVJkyj5-uUgD71yAkzRTWGjr9nhDQkph6zr8Ov2ZLByLg=mo,Why forcing us to do something that we don't want to do?... Let us rearrange and delete our pictures freely,1,6,5.368.0,2024-05-11 00:04:52,"Our team moderates based on our photo guidelines (https://bit.ly/3tU0sBS). If you think there’s been a mistake, our team would be more than happy to take a second look. Please send us a message here: bumble.com/contact. We’re here for you! 💛",2024-05-11 07:53:19,5.368.0
91b69c65-62d6-4c0e-8872-52423b682008,Slynn Byrd,https://play-lh.googleusercontent.com/a/ACg8ocI4lH0kU4g5VIqqMDwyEAHscotRWrhfHDFSsYo7B3ApkzzVhQ=mo,Great.,5,0,5.368.0,2024-05-10 23:06:38,We appreciate your kind words. 🙌,2024-05-11 06:49:20,5.368.0
f2956ba4-b25b-44f0-a6a2-6e6c0c817e6a,Cody Santos,https://play-lh.googleusercontent.com/a-/ALV-UjXjhTdMvuy7uxD4nPzn13uc4aaGK5-3dn50zJpyS5V-VvluDf4G,Worst dating app out here. Tinder is better. Bumble has an awful layout the app is annoying to navigate. Overall shifty stuff on bumble. Do yourself a favor and download tinder or use facebook dating lol this app is junk,1,5,5.368.0,2024-05-10 22:56:59,We're sorry you didn't enjoy your experience on Bumble. Our team would love the opportunity to improve your experience in the Hive! Please message our Support Team on Twitter or Facebook (@BumbleSupport) and we'd be happy to help.,2024-05-11 06:49:19,5.368.0
511cd2a0-e383-4df3-aeca-c9bd8a89e31f,Nic S.,https://play-lh.googleusercontent.com/a-/ALV-UjXhn9z16k4xSImYZdA-x6kXXQqO_JWnCh0WPGgZ3xyXFl_E1hnw9Q,They charged my card several times. They will not respond to emails or refund me. Just stick with Tinder or Hinge.,1,1,5.305.1,2024-05-10 22:52:14,We’re so sorry to hear this happened and would like our Billing team to have a look. Please send us a message at http://bumble.com/contact or on Facebook or Twitter (@BumbleSupport). We look forward to hearing from you!,2024-05-11 06:44:49,5.305.1
a360fcd4-cb8d-4924-9db7-a3a8fc63283a,Vishvjeet Cheema,https://play-lh.googleusercontent.com/a-/ALV-UjVKgWHMiNRb17GJ-LLxFeYVJLPdGWiq9DBxW9pqwZdquOkPjUkH,Useless garbage,1,5,,2024-05-10 22:23:15,We're sorry you didn't enjoy your experience on Bumble. Our team would love the opportunity to improve your experience in the Hive! Please message our Support Team on Twitter or Facebook (@BumbleSupport) and we'd be happy to help.,2024-05-11 06:44:20,
3490f0d1-1632-4121-ad43-08bef37d1dc5,Zangdaarr Mortpartout,https://play-lh.googleusercontent.com/a-/ALV-UjX73_xuW3i1O7loIbMeSVmQg2iRqcTJNh_PUPxoKJQI-SnQ7o8,"I deleted my account almost a year ago, I wanted to re-create one only to found out that I am banned (and it was really hard to understand as the app does not state it clearly) They won't provide a reason for that, there is none. I had zero complaints and if I had I would have been banned before I delete my account. edit: wad actually never banned. their support sucks and will lie rather than actually investigate answer to the team: this is blablant lie.",1,1,5.355.0,2024-05-10 22:16:44,"We want to take a look at this. Please message us at @BumbleSupport on Twitter or Facebook. Or, you can contact us via bumble.com/contact.",2024-05-11 06:44:19,5.355.0
de2564bc-4ce8-49bb-be10-da68ba6198a1,Daniel Wong,https://play-lh.googleusercontent.com/a-/ALV-UjVtSTa-31jMp8KKL1kOLvYQ9ot_qJq1UGGm2NgNZJ0A6xM-p_uoKA,"Decreasing my rating to 2. It appears with the rebrand, men now can message first, and new monetization models Bumble is hoping to increase their falling shareholder value similar to Match Group. These new monetization models are a roll of the dice, and doesn't necessarily help people who are already struggling on app to find someone. The app is going down hill and I recommend finding an alternative that isn't touched by Wall Street.",2,6,5.368.0,2024-05-10 22:09:06,"This definitely doesn't sound right, and we're sorry to read about it. Please message our Support Team on Twitter or Facebook (@BumbleSupport), so our team can take a look.",2024-05-11 06:41:48,5.368.0
abdfde23-8e4a-47c5-a699-c6cea22930f0,farhad mirzahoseini,https://play-lh.googleusercontent.com/a/ACg8ocLlXMI8PqJJ5mbUby9hsLyESNsUE0fIuIolhP9AnHFjTe_6pw=mo,After a long time no one messaged me back!,1,1,,2024-05-10 21:52:28,"Sorry to hear you're having trouble connecting with your matches. Try sending a personalized, creative message or ask a question about something on their profile—that's sure to get the conversation started! You got this. 💛",2024-05-11 06:40:48,
f5524467-096c-4104-b9b5-c397641a8204,Pratik Dungule,https://play-lh.googleusercontent.com/a/ACg8ocI2rrBUFZKVrPJeW4fl-PEkgRO4B_bunfnItMalj7WalMdeKA=mo,Not opning in the morning its. Very trouble,1,0,,2024-05-10 21:32:15,"Thanks for letting us know, Pratik! We're reporting this to our team to fix. To help us out, please message us at @BumbleSupport on social media with a few more details—screenshots will help too. Or, you can contact us via bumble.com/contact",2024-05-10 22:27:19,
60495954-4250-47a2-bd3f-c13d9a35fc96,Carlos Emilio,https://play-lh.googleusercontent.com/a-/ALV-UjXc3noFgxI8SP6hT8pzrK0AsHU7E5ZLOTPHkt8olnC2lPfb_jxR,cool,5,1,5.368.0,2024-05-10 20:54:08,"We appreciate your kind words, Carlos. 🙌",2024-05-10 22:27:20,5.368.0
60d117cb-f2e6-40aa-ad03-8ed73ef4eb16,Irina K.,https://play-lh.googleusercontent.com/a-/ALV-UjU0rU7UQ6d_541PczYpAXPGjUkbzKz2BAYXQOw8w6BkrbaHp06w,"app is pretty good, but it would be a good idea to require mandatory profile verification, as there are a lot of scammers out there.",5,0,5.368.0,2024-05-10 20:49:29,"We're so sorry about your experience with us. We absolutely do not tolerate fake profiles on Bumble and would like to look into this. Please message our Support Team on Twitter or Facebook (@BumbleSupport), so our team can look into this.",2024-05-11 06:40:19,5.368.0
9285a463-ad6b-4ea7-8f80-351c00bfe442,Anthony Pina,https://play-lh.googleusercontent.com/a/ACg8ocJ8i9gsH9jkSShlPqDukuEawPDOizCtyx5JBjfo23F-v4XYjA=mo,It just now did not keep my last match!! And now she is gone forever!!!,2,1,,2024-05-10 20:14:03,"Thank you for your message. For further assistance, please get in touch with our support team at: bumble.com/contact. Thank you. 💛",2024-05-11 06:38:49,
114d0c94-e4ea-40bf-ba01-c1c3c5f624b2,Mampi Deb,https://play-lh.googleusercontent.com/a/ACg8ocI2N7tAYLIWbtNDw5EkToZ-_JlpbfWzDecmjlGpa1_oYEfLlA=mo,I don't use this app but I don't know who is using my pic in this app 😧 i don't likeeeee the security of this app 😡😡😡😡😡😡😡😡😡😡😡😡😡😡😡😡😡 this is not righttttttttt,1,5,5.368.0,2024-05-10 19:24:47,"We're sorry to hear that, Deb. Fake profiles are 100% not allowed on Bumble. No one deserves to go through that and we appreciate you bringing this to our attention. Our Safety Team would like to investigate this immediately. Please reach out via bumble.com/contact or @BumbleSupport on social media and we'll solve this ASAP. 💛",2024-05-11 09:46:19,5.368.0
d5dfb600-d3ea-4d4a-86ca-83233d7e158f,Davemike27,https://play-lh.googleusercontent.com/a/ACg8ocL-ljbx8zHdN_lyn6u3qW0YvEqG4yP6xHD1CHj16uSD-LPT5A=mo,"At first, Bumble changed, so women were the first to message ... That didn't work . Women hate taking a chance to be rejected. (Alot of women never bothered to learn how the app worked , id com across profiles telling men to message first). Now they realized women are terrified of thw rejection men deal with , so they let women choose a basic prompt so we can ""Audition"" for the privilege to be used for their Validation. Im tired of it ..... Men need to stop paying for premium services...",1,9,5.234.1,2024-05-10 19:00:20,"This definitely doesn't sound right, and we're sorry to read about it. Please message our Support Team on Twitter or Facebook (@BumbleSupport), so our team can take a look.",2024-05-11 06:35:49,5.234.1
e56308b6-d033-4a6b-b8a0-a129dfcf1f05,Saurav Basu,https://play-lh.googleusercontent.com/a-/ALV-UjWYgwZT0CqizE6QLAQlz1nIa7GOUClmEIE74bq6t1ypm7BCpIXS,"Thank you Bumble for disappointing me yet again! In short- 1. There is a payment wall every 7-10 matches. 2. Can't compliment people. 3. Matches vanish. 4. Ads have more value. I have used bumble for quite some time. 5. Also, Can't put up an edited video, because it doesn't fit dimensions. Seriously?😒 I thought the people behind it were genuine about people finding matches but the recent years has made me think otherwise!",1,268,5.368.0,2024-05-10 18:44:29,"This definitely doesn't sound right, and we're sorry to read about it. Please message our Support Team on Twitter or Facebook (@BumbleSupport), so our team can take a look.",2024-05-11 06:35:19,5.368.0
d9ab695e-ece3-49e2-b443-1af7dcd08dd2,Nicklaus,https://play-lh.googleusercontent.com/a/ACg8ocLXTqaHfWO2kyr0BFL2_rCsFkVQFQgIUGuP5qs8XKLUG9Uwhg=mo,"I mean it's just a joke. I get around 1-3 matches a day which is awesome. About 70% never message. 20% send ""hey"" then never respond after 1 message. I get some dates here and there but majority of woman on their are fake. Oh and now they switched it to where men have to send the first message now?!? LOL. I'll just go use Hinge",2,4,5.364.0,2024-05-10 18:33:00,"We're so sorry about your experience with us. We absolutely do not tolerate fake profiles on Bumble and would like to look into this. Please message our Support Team on Twitter or Facebook (@BumbleSupport), so our team can look into this.",2024-05-11 06:33:48,5.364.0
29033dd7-fa75-48cf-8cec-f9fdbf4a45af,Mike Labree,https://play-lh.googleusercontent.com/a-/ALV-UjVwODEYmxD8EjpJ1LO-3wbAVlW-6KEh-rEqK4_pzFfiXVo3V9cg,Described as a free app yet you have to purchase expensive premium to participate in app functions totally bogus,1,5,,2024-05-10 17:59:28,"Thank you for your feedback on this, Mike. We're sorry you didn't enjoy your experience on Bumble. While there are paid features, we also have free features that can be used. Our team would love the opportunity to improve your experience in the Hive! Please message our Support Team on Twitter or Facebook (@BumbleSupport); we'd be happy to help. 💛",2024-05-10 22:18:19,
5537ec4f-96c0-4dba-b64b-24387b934142,Gia Gia,https://play-lh.googleusercontent.com/a-/ALV-UjWYb_7srUflLou99TXzI-GJkLBqgjbldCUMcTvVAs3VBFKXQX44,"Literally you need to pay from the first second, otherwise u can't connect with nobody. I created the profile and apparently were 5 people that liked it, but to see whom, guess what, a payment was requested. I have no problem to pay for a service, but please allow me first to see what is all about, otherwise seems like a scam where the bots are sent to like u, just to make u pay. I don't recommend.",1,3,5.368.0,2024-05-10 17:37:41,You don't need to spend any money to match with admirers or notifications in your Beeline. These are people who have already swiped right on your profile and are waiting for you to swipe right on them. You can find them in your swipe deck for free.,2024-05-11 06:32:19,5.368.0
ec8cbf0e-8958-4dab-9b60-e878ff9345a0,Julius,https://play-lh.googleusercontent.com/a-/ALV-UjXPDmlDTKXexqtrJZ6uB7W2bPPiHOYzOgAoL8GHivuuFJbx-dhcGQ,hard to get matches,1,1,5.368.0,2024-05-10 17:26:28,"We're sorry to hear you haven't had the best experience on Bumble, Julius. For ideas to improve your profile check out these resources (1) bumble.com/the-buzz/best-bumble-profile-photo-tips and (2) bumble.com/help/i-m-not-getting-any-matches. 💛",2024-05-10 22:17:49,5.368.0
202d0827-5874-4596-b6e1-e2f9c39b491a,Zach Koch,https://play-lh.googleusercontent.com/a-/ALV-UjUP11jgvgf0RY5oH7_0LTFOZwl3TUIiajnC9s9dLlB4FPGhFU9_,"Uninstalled. This and Tinder are a joke. You want to meet someone? Go socialize with friends and meet new people. This app and others like it only keep you swiping to make you think you have a chance. More than half of the profiles are fake. If you are so lucky to match with somebody that is real and you're attracted to, the chance of them keeping the conversation rolling is slim to none. Bumble was a joke that sells your information to big corporations to make money off of your misfortune.",1,7,5.368.0,2024-05-10 17:09:00,"Our team fully investigates all reports before taking action and moderates based solely on our Community Guidelines. We would never arbitrarily block someone from our platform. If you would like our team to review your case, message @BumbleSupport on Twitter or Facebook. 🐝",2023-05-19 17:57:50,5.368.0
607837e8-a68e-4fc1-8222-1d0f94007daa,Dulce Mama das,https://play-lh.googleusercontent.com/a/ACg8ocJUJFqHsRhvd4dipu3V9UJlhsgdih0z1_urWlTHJ-liK_wj_w=mo,No recommended,1,2,,2024-05-10 16:14:53,"We're sorry you didn't enjoy your experience on Bumble, Dulce. Our team would love the opportunity to improve your experience in the Hive! Please message our Support Team on Twitter or Facebook (@BumbleSupport) and we'd be happy to help. ✨",2024-05-10 22:17:19,
22f19c7b-926e-4d32-a3a9-9ec90af5fe40,Rishabh Maithani,https://play-lh.googleusercontent.com/a/ACg8ocJU6Lg044cO66VFl31JeTRuCD_ZZjPah1mbIzKleKB3SZH20A=mo,This app may be good for girls but for boys👎👎👎👎,1,3,5.368.0,2024-05-10 16:12:36,We're sorry you didn't enjoy your experience on Bumble. Our team would love the opportunity to improve your experience in the Hive! Please message our Support Team on Twitter or Facebook (@BumbleSupport) and we'd be happy to help.,2024-05-10 16:32:19,5.368.0
f150ca92-a3be-48ed-af8a-fc2c0be657dc,Aditya Verma,https://play-lh.googleusercontent.com/a-/ALV-UjVchmcrxPYBj0wTR_HgiJ08SzGVF09UUd8X-2cEByaTrbR_uAI,"Well somehow the app didn't got me any matches as soon as I got the subscription. Weird app, probably rigged. Better to start off with a new number at the free account.",1,1,,2024-05-10 16:05:56,"Thanks for reaching out, Aditya. While our subscriptions are there to help maximize your experience, we can't promise exact results for anyone. If you’d like to talk to a Support Team Member about your profile to check everything is running as it should be, please message us here: bumble.com/contact.",2024-05-10 22:16:49,
af74d069-4c43-46ca-be6f-d08ba9cff1b6,Trevor wade,https://play-lh.googleusercontent.com/a/ACg8ocL6a3QawlSUGuOgelQzDIQXDM1OnXGBcj7MefWE0s2RaKUAgw=mo,Got a new phone number and I tried to use the app and it says I can't because the number used is tied to an account that acted inappropriate I haven't ever even used bumble before so why is my number being used on this site?,1,1,,2024-05-10 15:55:23,"Thanks for letting us know, Trevor! We're sorry for your experience so far. Our team fully investigates all reports before taking action and moderates based solely on our Community Guidelines. We would never arbitrarily block someone from our platform. If you would like our team to review your case, message @BumbleSupport on Twitter or Facebook.🫶",2024-05-10 22:16:21,
548fd0be-5505-45e9-89e5-d25222919386,bala krishnan,https://play-lh.googleusercontent.com/a-/ALV-UjXAOhJ_YYPMuWjFC7UauIMkn3GTg2EyOyvDOwjO4Q7-KHIWWAs,"I feel , they are real person's, because no one, because no one commit with me,☺️",5,0,5.365.0,2024-05-10 15:25:01,"Thanks for sharing this feedback with us, Bala! If you have any suggestions or improvements, feel free to contact us at @bumblesupport on Twitter or bumble.com/contact. 💌",2024-05-10 22:15:49,5.365.0
8a95e806-4753-467c-b3f4-ec547f01aae7,Daniel Patron,https://play-lh.googleusercontent.com/a-/ALV-UjWZqGsXK7Io_ZeNXplaDygtB5KBtVhe88k5lN_-jmmbW1RY2TJu,"It's good,",5,0,,2024-05-10 15:15:27,We're so happy to hear that! We love that you enjoy buzzin' in the Hive. 🐝,2024-05-10 16:31:49,
